{
  "$schema": "http://json-schema.org/draft-04/schema#",
  "type": "object",
  "properties": {
    "observations": {
      "type": "array",
      "items": [
        {
          "type": "object",
          "properties": {
            "address": {
              "type": "string"
            },
            "name": {
              "type": "string"
            },
            "backend": {
              "type": "object",
              "properties": {
                "type": {
                  "type": "string"
                },
                "format": {
                  "type": "string"
                },
                "properties": {
                  "type": "object"
                }
              },
              "required": [
                "type",
                "format"
              ]
            },
            "locations": {
              "type": "object",
              "properties": {
                "identify": {
                  "type": "boolean"
                },
                "from": {
                  "type": "string"
                },
                "pattern": {
                  "type": "string"
                },
                  "ids": {
                      "type": "array",
                      "items": {
                          "type": "string"
                      }
                  }
              },
              "required": [
                "identify"
              ]
            },
            "field_mapping": {
              "type": "array",
              "items": [
                {
                  "type": "object",
                  "properties": {
                    "field": {
                      "type": "string"
                    },
                    "mapType": {
                      "type": "string"
                    },
                    "value": {
                      "type": "string"
                    }
                  },
                  "required": [
                    "field",
                    "mapType",
                    "value"
                  ]
                }
              ]
            }
          },
          "required": [
            "address",
            "name",
            "backend"
          ]
        }
      ]
    },
    "predictions": {
      "type": "array",
      "items": [
        {
          "type": "object",
          "properties": {
            "address": {
              "type": "string"
            },
            "name": {
              "type": "string"
            },
            "backend": {
              "type": "object",
              "properties": {
                "type": {
                  "type": "string"
                },
                "format": {
                  "type": "string"
                },
                "properties": {
                  "type": "object"
                }
              },
              "required": [
                "type",
                "format"
              ]
            },
            "locations": {
              "type": "object",
              "properties": {
                "identify": {
                  "type": "boolean"
                },
                "from": {
                  "type": "string"
                },
                "pattern": {
                  "type": "string"
                },
                  "ids": {
                      "type": "array",
                      "items": {
                          "type": "string"
                      }
                  }
              },
              "required": [
                "identify"
              ]
            },
            "field_mapping": {
              "type": "array",
              "items": [
                {
                  "type": "object",
                  "properties": {
                    "field": {
                      "type": "string"
                    },
                    "mapType": {
                      "type": "string"
                    },
                    "value": {
                      "type": "string"
                    }
                  },
                  "required": [
                    "field",
                    "mapType",
                    "value"
                  ]
                }
              ]
            }
          },
          "required": [
            "address",
            "name",
            "backend"
          ]
        }
      ]
    },
    "crosswalks": {
      "type": "array",
      "items": [
        {
          "type": "object",
          "properties": {
            "type": {
              "type": "string"
            },
            "format": {
              "type": "string"
            },
            "address": {
              "type": "string"
            },
            "prediction_fields": {
              "type": "array",
              "items": [
                {
                  "type": "object",
                  "properties": {
                    "field": {
                      "type": "string"
                    },
                    "path": {
                      "type": ["array", "null"],
                      "items": [
                        {
                          "type": "string"
                        }
                      ]
                    }
                  },
                  "required": [
                    "field"
                  ]
                }
              ]
            },
            "observation_fields": {
              "type": "array",
              "items": [
                {
                  "type": "object",
                  "properties": {
                    "field": {
                      "type": "string"
                    },
                    "path": {
                      "type": "array",
                      "items": [
                        {
                          "type": "string"
                        }
                      ]
                    }
                  },
                  "required": [
                    "field"
                  ]
                }
              ]
            }
          },
          "required": [
            "type",
            "format",
            "address",
            "prediction_fields",
            "observation_fields"
          ]
        }
      ]
    },
    "thresholds": {
      "type": "array",
      "items": [
        {
          "type": "object",
          "properties": {
            "address": {
              "type": "string"
            },
            "backend": {
              "type": "object",
              "properties": {
                "type": {
                  "type": "string"
                },
                "format": {
                  "type": "string"
                },
                  "properties": {
                      "type": "array",
                      "items": {
                          "type": "object"
                      }
                  }
              },
              "required": [
                "type",
                "format"
              ]
            },
            "locations": {
              "type": "object",
              "properties": {
                "identify": {
                  "type": "boolean"
                },
                "from": {
                  "type": "string"
                },
                "pattern": {
                  "type": "string"
                }
              },
              "required": [
                "identify"
              ]
            },
            "definitions": {
              "type": "array",
              "items": [
                {
                  "type": "object",
                  "properties": {
                    "name": {
                      "type": "string"
                    },
                    "field": {
                      "type": "string"
                    },
                      "weight": {
                        "type": "number"
                      }
                  },
                  "required": [
                    "name",
                    "field",
                      "weight"
                  ]
                }
              ]
            }
          },
          "required": [
            "address",
            "backend",
            "definitions"
          ]
        }
      ]
    },
    "scheme": {
      "type": "object",
      "properties": {
        "metrics": {
          "type": "array",
            "minItems": 1,
            "uniqueItems": true,
          "items": [
            {
              "type": "object",
              "properties": {
                "name": {
                  "type": "string"
                },
                "weight": {
                  "type": "integer"
                },
                  "properties": {
                      "type": "array",
                      "items": {
                          "type": "object"
                      }
                  }
              },
              "required": [
                "name",
                "weight"
              ]
            }
          ]
        }
      },
      "required": [
        "metrics"
      ]
    }
  },
  "required": [
    "observations",
    "predictions",
    "crosswalks",
    "thresholds",
    "scheme"
  ]
}