{
    "observations": [
        {
            "name": "Observations",
            "value_field": "observation",
            "value_selectors": [
                {
                    "name": "observation",
                    "where": "value",
                    "path": ["values[*]", "value[*]", "value"],
                    "datatype": "float",
                    "origin": ["$", "value", "timeSeries[*]"],
                    "associated_fields": [
                        {
                            "name":"value_date",
                            "path": ["values[*]", "value[*]", "dateTime"],
                            "datatype": "datetime"
                        },
                        {
                            "name":"observation_location",
                            "path": ["sourceInfo", "siteCode", "[0]", "value"],
                            "datatype": "string"
                        },
                        {
                            "name":"unit",
                            "path": ["variable", "unit", "unitCode"],
                            "datatype": "string"
                        }
                    ]
                }
            ],
            "backend": {
                "backend_type": "file",
                "data_format": "json",
                "address": "path/to/observations.json"
            },
            "locations": {
                "identify": "true",
                "from_field": "value"
            },
            "unit": {
                "field": "unit"
            },
            "x_axis": "value_date"
        }
    ],
    "predictions": [
        {
            "name": "Predictions",
            "value_field": "prediction",
            "value_selectors": [
                {
                    "name": "predicted",
                    "where": "column",
                    "associated_fields": [
                        {
                            "name": "date",
                            "datatype": "datetime"
                        }
                    ]
                }
            ],
            "backend": {
                "backend_type": "file",
                "data_format": "csv",
                "address": "path/to/cat.*cfs.csv",
                "parse_dates": ["date"]
            },
            "locations": {
                "identify": "true",
                "from_field": "filename",
                "pattern": "cat-\\d\\d"
            },
            "field_mapping": [
                {
                    "field": "prediction",
                    "map_type": "column",
                    "value": "predicted"
                },
                {
                    "field": "prediction_location",
                    "map_type": "column",
                    "value": "location"
                },
                {
                    "field": "value_date",
                    "map_type": "column",
                    "value": "date"
                }
            ],
            "unit": {
                "value": "ft^3/s"
            },
            "x_axis": "value_date"
        }
    ],
    "crosswalks": [
        {
            "backend": {
                "backend_type": "file",
                "address": "path/to/crosswalk.json",
                "data_format": "json"
            },
            "observation_field_name": "observation_location",
            "prediction_field_name": "prediction_location",
            "field": {
                "name": "prediction_location",
                "where": "key",
                "path": ["* where site_no"],
                "origin": "$",
                "datatype": "string",
                "associated_fields": [
                    {
                        "name": "observation_location",
                        "path": "site_no",
                        "datatype": "string"
                    }
                ]
            }
        }
    ],
    "thresholds": [
        {
            "backend": {
                "backend_type": "file",
                "data_format": "rdb",
                "address": "path/to/stat_thresholds.rdb"
            },
            "locations": {
                "identify": "true",
                "from_field": "column",
                "pattern": "site_no"
            },
            "application_rules": {
                "threshold_field": {
                    "name": "threshold_day",
                    "path": [
                        "month_nu",
                        "day_nu"
                    ],
                    "datatype": "Day"
                },
                "observation_field": {
                    "name": "threshold_day",
                    "path": [
                        "value_date"
                    ],
                    "datatype": "Day"
                }
            },
            "definitions": [
                {
                    "name": "75th Percentile",
                    "field": "p75_va",
                    "weight": 10,
                    "unit": {
                        "value": "ft^3/s"
                    }
                }
            ]
        },
        {
            "backend": {
                "backend_type": "file",
                "data_format": "json",
                "address": "path/to/thresholds.json"
            },
            "locations": {
                "identify": "true",
                "from_field": "value",
                "pattern": "metadata/usgs_site_code"
            },
            "origin": "$.value_set[?(@.calc_flow_values.rating_curve.id_type == 'NWS Station')]",
            "definitions": [
                {
                    "name": "Action",
                    "field": "calc_flow_values/action",
                    "weight": 3,
                    "unit": {
                        "path": "metadata/calc_flow_units"
                    }
                },
                {
                    "name": "Flood",
                    "field": "calc_flow_values/flood",
                    "weight": 2,
                    "unit": {
                        "path": "metadata/calc_flow_units"
                    }
                }
            ]
        }
    ],
    "scheme": {
        "metrics": [
            {
                "name": "False Alarm Ratio",
                "weight": 10
            },
            {
                "name": "Probability of Detection",
                "weight": 10
            },
            {
                "name": "Kling-Gupta Efficiency",
                "weight": 15
            },
            {
                "name": "Normalized Nash-Sutcliffe Efficiency",
                "weight": 15
            },
            {
                "name": "Pearson Correlation Coefficient",
                "weight": 18
            }
        ]
    }
}